<!DOCTYPE list SYSTEM "instances.dtd">
<list>
	<!-- Pailaka Devils Legacy (Level 61-67) -->
	<instance id="44" name="Pailaka (Devil's Isle)" maxChannels="15" collapseIfEmpty="10" timelimit="180">
		<collapse on-party-dismiss="true" timer="60"/>
		<level min="61" max="67"/>
		<party min="1" max="1"/>
		<return loc="85176 147592 -3408"/>
		<teleport loc="76438 -219035 -3752"/>
		<remove itemId="0" count="0" necessary="false"/>
		<give itemId="0" count="0"/>
		<quest id="129"/>
		<reuse resetReuse="30 6 * * *" setUponEntry="true" sharedReuseGroup="0"/>
		<spawns>
			<spawn mobId="18622" type="point" respawn="120">
				<coords loc="79189 -210458 -3753 8353"/>
				<coords loc="77923 -205411 -3585 32501"/>
				<coords loc="78213 -205549 -3585 13028"/>
				<coords loc="79420 -209913 -3753 24575"/>
				<coords loc="79100 -205721 -3585 8231"/>
				<coords loc="79254 -205268 -3585 3283"/>
			</spawn>
			<spawn mobId="18623" type="point" respawn="0">
				<coords loc="87222 -209251 -3747 41489"/>
				<coords loc="87964 -212354 -4222 49807"/>
				<coords loc="86829 -209914 -4058 50941"/>
				<coords loc="87018 -209216 -3747 49151"/>
				<coords loc="87888 -212418 -4224 40068"/>
				<coords loc="86742 -209412 -3826 1075"/>
			</spawn>
			<spawn mobId="18624" type="point" respawn="0">
				<coords loc="79486 -215189 -3586 55522"/>
				<coords loc="79611 -215670 -3573 3572"/>
				<coords loc="76454 -215338 -3697 62044"/>
				<coords loc="78906 -213577 -3745 32890"/>
				<coords loc="76759 -215785 -3713 11152"/>
				<coords loc="74707 -215828 -3713 64106"/>
				<coords loc="78818 -212675 -3753 49009"/>
				<coords loc="78286 -214185 -3649 1605"/>
				<coords loc="74678 -213426 -3713 45938"/>
				<coords loc="78330 -214027 -3674 61972"/>
				<coords loc="75010 -215381 -3713 58176"/>
				<coords loc="80271 -216861 -3588 33758"/>
				<coords loc="79815 -216744 -3575 39237"/>
				<coords loc="79403 -220622 -3624 31252"/>
				<coords loc="79911 -216924 -3572 32563"/>
				<coords loc="78460 -213654 -3733 34295"/>
				<coords loc="79361 -220351 -3630 35178"/>
				<coords loc="82238 -217209 -3729 46104"/>
				<coords loc="82651 -217111 -3729 50219"/>
				<coords loc="78997 -220017 -3628 40111"/>
				<coords loc="83245 -216852 -3729 56758"/>
				<coords loc="83217 -215436 -3729 53234"/>
				<coords loc="79296 -219808 -3641 42225"/>
				<coords loc="82393 -215414 -3729 54126"/>
				<coords loc="78512 -218154 -3697 57046"/>
				<coords loc="78296 -218497 -3697 58070"/>
			</spawn>
			<spawn mobId="18625" type="point" respawn="0">
				<coords loc="79342 -205928 -3585 62817"/>
				<coords loc="79625 -208324 -3753 49477"/>
				<coords loc="79422 -206109 -3585 19137"/>
				<coords loc="79886 -205132 -3585 37757"/>
				<coords loc="79058 -205470 -3585 24122"/>
				<coords loc="78857 -205432 -3585 26526"/>
				<coords loc="78935 -205219 -3585 27835"/>
				<coords loc="78918 -205266 -3585 24094"/>
				<coords loc="79167 -205395 -3585 27931"/>
				<coords loc="79414 -205263 -3585 33316"/>
				<coords loc="81320 -206750 -3585 11373"/>
				<coords loc="81573 -207488 -3585 12160"/>
				<coords loc="79044 -207967 -3753 21699"/>
				<coords loc="81631 -208349 -3585 45651"/>
				<coords loc="79587 -207997 -3756 15805"/>
				<coords loc="82232 -205882 -3585 21479"/>
				<coords loc="79368 -208051 -3753 15162"/>
				<coords loc="82001 -205932 -3585 23053"/>
				<coords loc="82343 -205311 -3585 29058"/>
				<coords loc="79465 -205126 -3585 29412"/>
				<coords loc="81931 -208453 -3585 37604"/>
				<coords loc="79295 -210439 -3753 55955"/>
				<coords loc="79522 -209584 -3756 29801"/>
				<coords loc="79265 -209751 -3753 40463"/>
				<coords loc="79301 -210104 -3753 52776"/>
				<coords loc="79451 -210279 -3753 56543"/>
				<coords loc="79686 -209965 -3756 12073"/>
				<coords loc="79888 -215504 -3593 63852"/>
				<coords loc="78530 -218248 -3697 56462"/>
				<coords loc="79420 -209698 -3753 25422"/>
				<coords loc="86624 -219483 -3721 29643"/>
				<coords loc="83051 -216042 -3729 57233"/>
				<coords loc="79143 -210240 -3756 46228"/>
				<coords loc="83640 -219434 -4004 24575"/>
				<coords loc="83412 -219389 -4004 8804"/>
				<coords loc="78855 -214065 -3669 53553"/>
				<coords loc="78780 -214164 -3653 60512"/>
				<coords loc="79299 -208457 -3753 36821"/>
				<coords loc="77356 -205470 -3585 55355"/>
				<coords loc="77775 -205628 -3585 50928"/>
				<coords loc="77716 -205324 -3585 55863"/>
				<coords loc="79664 -208559 -3753 61651"/>
				<coords loc="78317 -208988 -3921 46182"/>
				<coords loc="77932 -208870 -3927 49151"/>
				<coords loc="77612 -209977 -3908 46498"/>
				<coords loc="78055 -209934 -3908 48076"/>
				<coords loc="78584 -212812 -3753 666"/>
				<coords loc="78720 -212881 -3753 48947"/>
				<coords loc="78844 -213375 -3753 41833"/>
				<coords loc="78836 -213555 -3748 29591"/>
				<coords loc="79457 -208682 -3753 20607"/>
			</spawn>
			<spawn mobId="18626" type="point" respawn="0">
				<coords loc="83267 -213306 -3345 33653"/>
				<coords loc="82833 -213431 -3345 37385"/>
				<coords loc="81171 -212063 -3425 42114"/>
				<coords loc="80936 -212424 -3425 54292"/>
				<coords loc="83460 -213867 -3345 32670"/>
				<coords loc="83089 -213820 -3345 20229"/>
				<coords loc="81099 -213800 -3348 58641"/>
				<coords loc="81092 -213544 -3345 15086"/>
				<coords loc="80644 -213255 -3345 26956"/>
				<coords loc="80249 -213787 -3345 3243"/>
				<coords loc="80772 -212208 -3425 9977"/>
				<coords loc="80642 -212382 -3425 5139"/>
				<coords loc="81621 -209250 -3585 9457"/>
				<coords loc="81754 -208403 -3585 38697"/>
				<coords loc="81905 -208811 -3585 26769"/>
				<coords loc="81173 -207246 -3585 7437"/>
				<coords loc="81637 -207101 -3585 2612"/>
				<coords loc="81756 -207296 -3585 2762"/>
				<coords loc="82104 -207234 -3588 3742"/>
				<coords loc="82400 -205624 -3585 19198"/>
				<coords loc="81922 -209050 -3585 24780"/>
				<coords loc="82279 -205774 -3585 26243"/>
				<coords loc="83209 -211920 -3425 34872"/>
				<coords loc="82759 -212205 -3425 44874"/>
				<coords loc="82631 -212425 -3425 52034"/>
				<coords loc="82614 -212207 -3428 53485"/>
			</spawn>
			<spawn mobId="18627" type="point" respawn="0">
				<coords loc="86049 -216957 -2465 41586"/>
				<coords loc="85355 -214573 -2465 55310"/>
				<coords loc="85134 -216585 -2465 7334"/>
				<coords loc="84935 -216565 -2465 16549"/>
				<coords loc="84821 -216989 -2465 46401"/>
				<coords loc="85362 -217332 -2465 12227"/>
				<coords loc="86153 -215291 -2465 10142"/>
				<coords loc="86361 -215239 -2464 2555"/>
				<coords loc="86111 -215590 -2468 38573"/>
				<coords loc="86400 -215389 -2464 3792"/>
				<coords loc="84941 -214854 -2465 17871"/>
				<coords loc="86214 -216540 -2468 31298"/>
				<coords loc="86260 -216719 -2465 63227"/>
				<coords loc="86558 -216544 -2465 46930"/>
				<coords loc="85056 -215233 -2465 24159"/>
				<coords loc="84372 -214622 -3025 26546"/>
				<coords loc="84178 -213369 -3345 46395"/>
				<coords loc="84441 -213264 -3345 59962"/>
				<coords loc="82914 -215701 -2708 49730"/>
				<coords loc="84378 -213761 -3345 20607"/>
				<coords loc="83045 -215412 -2705 50043"/>
				<coords loc="84599 -213811 -3345 38965"/>
				<coords loc="82800 -215391 -2705 36991"/>
				<coords loc="82449 -215572 -2705 39097"/>
				<coords loc="85325 -215400 -2465 20126"/>
				<coords loc="84543 -214290 -3025 31692"/>
			</spawn>
			<spawn mobId="18629" type="point" respawn="0">
				<coords loc="80699 -219268 -3521 11650"/>
			</spawn>
			<spawn mobId="18630" type="point" respawn="0">
				<coords loc="77981 -205910 -3585 1186"/>
			</spawn>
			<spawn mobId="18631" type="point" respawn="0">
				<coords loc="82629 -209487 -3585 142"/>
			</spawn>
			<spawn mobId="18632" type="point" respawn="0">
				<coords loc="82387 -217356 -2705 64839"/>
			</spawn>
			<spawn mobId="18633" type="point" respawn="0">
				<coords loc="87881 -209137 -3747 32525"/>
			</spawn>
			<spawn mobId="32495" type="point" respawn="60">
				<coords loc="80069 -213849 -3345 2092"/>
				<coords loc="75940 -205504 -3688 47671"/>
				<coords loc="74933 -212142 -3713 49251"/>
				<coords loc="77032 -213457 -3713 33057"/>
				<coords loc="76248 -216565 -3658 11667"/>
				<coords loc="78570 -216344 -3593 32767"/>
				<coords loc="80152 -214362 -3593 32591"/>
				<coords loc="87113 -219160 -3700 36919"/>
				<coords loc="82069 -215191 -3729 0"/>
				<coords loc="81474 -218808 -3521 36284"/>
				<coords loc="85297 -214369 -2465 48897"/>
				<coords loc="82079 -215290 -2705 356"/>
				<coords loc="77317 -205198 -3585 55710"/>
				<coords loc="85090 -214689 -3025 33482"/>
				<coords loc="86736 -217103 -2465 16383"/>
				<coords loc="85187 -213664 -3345 32091"/>
				<coords loc="82764 -217077 -2705 0"/>
				<coords loc="86020 -220575 -3729 14459"/>
				<coords loc="86058 -215531 -2465 65255"/>
				<coords loc="85263 -217540 -2465 19243"/>
				<coords loc="83316 -212502 -3425 31644"/>
				<coords loc="80352 -212518 -3425 707"/>
			</spawn>
			<spawn mobId="32501" type="point" respawn="0">
				<coords loc="77015 -218933 -3757 31871"/>
			</spawn>
			<spawn mobId="32508" type="point" respawn="0">
				<coords loc="82736 -205312 -3585 32767"/>
				<coords loc="81719 -210866 -3585 10557"/>
				<coords loc="78696 -214888 -3593 50891"/>
			</spawn>
		</spawns>
		<zones>
			<zone name="[22_11_water1]" active="true"/>
			<zone name="[21_25_water1]" active="true"/>
		</zones>
	</instance>
</list>