<!DOCTYPE list SYSTEM "instances.dtd">
<list>
	<!-- Town of Schuttgart: NPC Vishotsky (Level 66)  -->
	<instance id="70" name="Kamaloka, Hall of the Abyss" maxChannels="10" collapseIfEmpty="10" timelimit="30" dispelBuffs="false">
		<collapse on-party-dismiss="true" timer="60"/>
		<level min="61" max="71"/>
		<party min="2" max="6"/>
		<return loc="85962 -142187 -1344"/>
		<teleport loc="23648 -213600 -8000"/>
		<remove itemId="0" count="0" necessary="false"/>
		<give itemId="0" count="0"/>
		<quest id="0"/>
		<reuse resetReuse="30 6 * * *" setUponEntry="false" sharedReuseGroup="1"/>
		<add_parameters>
			<param name="tele_device_loc" value="23655 -213048 -8000"/>
		</add_parameters>
		<spawns>
			<!-- Kel Bilette -->
			<spawn mobId="18573" type="loc">
				<coords loc="23459 -212855 -8000 -8000"/>
				<coords loc="23459 -213255 -8000 -8000"/>
				<coords loc="23859 -213255 -8000 -8000"/>
				<coords loc="23859 -212855 -8000 -8000"/>
			</spawn>
			<!-- Follower of Bilette -->
			<spawn mobId="18574" count="4" respawn="30" type="loc">
				<coords loc="23459 -212855 -8000 -8000"/>
				<coords loc="23459 -213255 -8000 -8000"/>
				<coords loc="23859 -213255 -8000 -8000"/>
				<coords loc="23859 -212855 -8000 -8000"/>
			</spawn>
		</spawns>
	</instance>
</list>