<!DOCTYPE list SYSTEM "instances.dtd">
<list>
	<instance id="605" name="KoreanMap3" maxChannels="40" collapseIfEmpty="1" timelimit="120" dispelBuffs="false">
		<level min="1" max="85"/>
		<party min="1" max="1"/>
		<add_parameters>
			<param name="Right1" value="-19576, 280024, -13376, 0" />
			<param name="Right2" value="-19576, 277160, -13376, 0" />
			<param name="Left1" value="-18488, 280024, -13376, 32767" />
			<param name="Left2" value="-18488, 277160, -13376, 32767" />
			<param name="RightCenter" value="-19016, 278104, -13376" />
			<param name="LeftCenter" value="-19016, 279064, -13376" />
		</add_parameters>
		<zones>
			<zone name="[whole_world]" active="true"/>
		</zones>
	</instance>
</list>