<!DOCTYPE list SYSTEM "instances.dtd">
<list>
	<instance id="149" name="Olympiad" maxChannels="40" collapseIfEmpty="1" timelimit="60" dispelBuffs="true">
		<level min="1" max="85"/>
		<party min="1" max="1"/>
		<geodata map="17_10"/>
		<teleport loc="-89176 -239352 -8474 0" />
		<teleport loc="-87000 -239352 -8474 0" />
		<teleport loc="-87382 -238952 -8474 0" />
		<doors>
			<door id="17100201"/>
			<door id="17100202"/>
		</doors>
		<spawns>
			<group name="olympiad_149_buffers" spawned="false"/>
		</spawns>
		<zones>
			<zone name="[olympiad_arena_149]" active="true"/>
		</zones>
	</instance>
</list>